id,item,account_name,page_type,count_of_reviews,retailer_sku_name,product_url,star_rating,count_of_star_ratings,screen_size,final_sku_price,original_sku_price,savings,offer,pick_up_availability,fastest_delivery,delivery_availability,shipping_info,sku_status,detailed_review_content,summarized_review_content,top_mentions,recommendation_intent,main_rank,bsr_rank,promotion_position,trend_rank,retailer_sku_name_similar,estimated_annual_electricity_use,promotion_type,calendar_week,crawl_datetime,model_year,batch_id,country
296306,J2FPJKSV76,Bestbuy,main,"3,337","Insignia™ - 55"" Class F50 Series LED 4K UHD Smart Fire TV",https://www.bestbuy.com/product/insignia-55-class-f50-series-led-4k-uhd-smart-fire-tv/J2FPJKSV76,4.7,"3,337",55 inches,$199.99 ,$349.99 ,$150 ,2,Pick up tomorrow,,"Delivery as soon as Wed, May 20",,,"review1 - This is my first time purchasing a tv and I’ve had the opportunity to watch on many screens in my hairs but it’s lightweight, easy set up, amazing quality (I truly haven’t slept in my bed, I’m sleeping on my pull out nightly just to sneak in my shows) feels like I’m truly immersed. I also haven’t connected it to my speaks because the sound quality on it is amazing! ||| review2 - Very nice television. Picture are very clear and nice. Easily installed. Product very light weight. Very smart. The remote easy to use.You do not need a cable box to used television.As long as you have wifi you are all set to go. That is how smart this television is. Perfect in any part of the house. Lighted part or darker part.Thus television as a timer to it. If its idles for too long some how it knows and will shut off for yoy. Or you can set your own sleeping timer to it. ||| review3 - I’m very happy with this Insignia 55” Fire TV. The picture quality is clear and vibrant, especially in 4K, and the screen size is perfect for movies and shows. Setup was super easy, and the built-in Fire TV makes it very convenient to access Netflix, Prime Video, Hulu, and more without needing extra devices. The sound is decent for everyday use, and the TV runs smoothly without lag. For the price, this is an excellent value and works perfectly for my living room. I would definitely recommend it to anyone looking for an affordable and reliable smart TV. ||| review4 - Great quality, very easy to setup, and light. Took 1 person & 15 mins to setup. Definitely performs on par with other TV’s in its price range. ||| review5 - I am thoroughly delighted with this purchase, as the tv fits perfectly in my bedroom. Both the picture and sound quality far exceed expectations for its price range. Considering the affordability, the level of performance feels like an incredible bargain—almost too good to be true. I would wholeheartedly recommend this product to others, and I am genuinely satisfied with my decision to buy it. ||| review6 - Great smart TV powered by firetv. Very ez setup and the color, sound, size and simplicity of the controls works very well in the bedroom. ||| review7 - The TV for the price is really hard to beat. The image quality during gaming, movies, ans TV are great. The colors are also fantastic for the price. The downside is the closed captions are a bit grainy and the operating system of the FireTV are Okay at best. It gets the job done but is a bit slow. I'd definitely recommend another device to stream from that doesn't feel so clunky. The TV itself was physically easy to mount with no issue what so ever and set up was also simple. Like I said for the price you cant really beat it even with quirks! ||| review8 - I recently upgraded to the Insignia 55″ Class F50 Series LED 4K UHD Smart Fire TV and overall I’m quite pleased. Right out of the box the 4K image looked noticeably sharper and the colors more vibrant compared to my previous 1080p set. The Fire TV interface is intuitive, the Alexa voice remote is handy, and setup was quick. Watching Netflix, YouTube and streaming sports has been really enjoyable — the screen size and clarity make a difference. On the flip side, when watching late at night in a darker room I did notice that the blacks aren’t as deep as those on premium sets I’ve seen, and fast-motion content (especially high-end gaming) lacks the ultra-smoothness of higher refresh-rate TVs. The built-in speakers are good for general viewing, but if you want full cinematic audio you’ll want a soundbar. Bottom line: For the price this is a great value 55″ 4K Smart TV. If you don’t demand the very top-tier picture specs, it hits a sweet spot of size, functionality, and affordability. Would I recommend it? Yes — if you’re after a solid upgrade and value smart features and screen size more than ultra-premium specs. ||| review9 - We're gonna have a TV party tonight All right! We're gonna have a TV party, all right Tonight! We've got nothing better to do Than watch TV and have a couple of brews Everybody's gonna hang out here tonight All right! We'll pass out on the couch, all right Tonight! We've got nothing better to do Than watch TV and have a couple of brews Don't talk about anything else We don't want to know We're dedicated to our favorite shows That's incredible! Hill Street Blues! Dallas! Fridays! We sit glued to the TV set all night And every night Why go into the outside world at all It's such a fright We've got nothing better to do Than watch TV and have a couple of brews TV news shows What it's like out there It's a scare You can go out if you want We wouldn't dare We've got nothing better to do Than watch TV and have a couple of brews Don't talk about anything else We don't want to know We're dedicated to our favorite shows Saturday Night Live! Monday Night Football! Jeffersons! Vegas! I wouldn't be without my TV for a day Or even a minute Don't even bother to use my brain any more There's nothing left in it We've got nothing better to do Than watch TV and have a couple of brews Hey, wait a minute, my TV doesn't work! It's broken! What are we gonna do tonight, this isn't fair! We're hurtin' We've got nothing left to do Left with no TV just a couple of brews What are we gonna talk about? I don't know! We're gonna miss our favorite shows! No That's Incredible! No Monday Night Football! No Jeffersons! No Friday! No TV party tonight! ||| review10 - I recently purchased the Insignia 55-inch Amazon Fire TV, and I couldn’t be happier! The picture quality is crisp and vibrant, with colors that really pop, and the 4K resolution makes movies and shows look stunning. The built-in Amazon Fire TV interface is seamless, making it super easy to navigate apps like Netflix, Prime Video, Hulu, and more—all without needing an extra streaming device. The remote is intuitive and responsive, and I love that it has Alexa voice control—it makes searching for shows or controlling smart home devices a breeze. Setup was quick and straightforward, and the TV feels solid and well-built for the price. Overall, this is an excellent choice if you’re looking for a large, smart TV that delivers amazing value. Highly recommend! ||| review11 - Love this tv. It’s the perfect size for my living room wall. Love all the features and getting it set up was easy ||| review12 - Amazing tv. So easy to set up. The sleek design to go with my decor. The size is perfect. Works well with a PlayStation. Great sound! ||| review13 - Great picture, super easy installation — stable with the included stand. Volume with built in speakers is pretty good and remote control / UI easy to use/navigate. A great investment for a TV if you’re a big streamer — tons of integrations with apps and the Alexa voice control works well. ||| review14 - A decent priced TV and the picture, the sound, the abilities of this thing make it worth $1,000,000! I’m so happy that we chose to stop by and check this one out because I don’t think anything else would have been able to compare for the price point. Plan on getting another fire tv from Best Buy when we move this one to our bedroom. ||| review15 - My mom needed a new TV and we got this as a replacement for her smaller 32"". She needed something with builtin in Smart TV functionality and this was the perfect choice. Setup was extremely easy and be ready to have an amazon account to sign into to speed things up. Thankfully my mother had her information ready! Picture quality is great! Sound could use a little more power but its enough in a bedroom as she is using it. The best part is the ease of use for my mother. ||| review16 - Great picture and I love the easy setup. As a older person this tv is easy for me to read and work ||| review17 - Great picture and easy to set up. Don’t need to use my fire stick because it’s already on the TV. My only complaint is the sound could be better. ||| review18 - Clear picture, great colors, easy to set up. I will purchase Insignia again in the future. ||| review19 - I picked up the 55-inch Insignia Fire TV and honestly love it. For the price, the picture quality is way better than expected—crisp 4K with solid colors and contrast. The built-in Fire TV makes streaming super easy, and having Alexa built right into the remote is a nice bonus. Setup was quick, and the interface is simple to navigate. It’s not a high-end TV, so the sound is just okay, but for everyday watching, gaming, or streaming, it’s a great value. Definitely one of the best budget TVs I’ve owned. ||| review20 - It’s a Great tv. It’s easy to use and it’s a great size to put on the wall.",,,93% would recommend to a friend,3,3,1,4,"Insignia™ - 55"" Class F50 Series LED 4K UHD Smart Fire TV ||| Insignia™ - 55"" Class QF Series QLED 4K UHD Smart Fire TV ||| Samsung - 55"" Class U7900 Series UHD 4K Smart Tizen TV (2025) ||| TCL - 55"" Class F35-Series 4K UHD HDR LED Smart Fire TV (2025)",243,DON’T-MISS DEALS ON TVs Big savings for a limited time,w20,2026-05-16 1:38,2025,b_20260516_010504,SEA
296307,J2FPJK9PZH,Bestbuy,main,"1,872","Insignia™ - 32"" Class F20 Series LED HD (720p) Smart Fire TV",https://www.bestbuy.com/product/insignia-32-class-f20-series-led-hd-720p-smart-fire-tv/J2FPJK9PZH/sku/6614070,4.4,"1,872",32 inches,$79.99 ,$129.99 ,$50 ,1,Pick up tomorrow,"Get it by Sun, May 17   • FREE",,,Sponsored,"review1 - Awesome television, especially for the price! It has a clear and bright picture, wifi connection, great sound, and it's lightweight, making it perfect to hang outside on my covered deck. I especiallly like that it's a Fire TV. It's connected to my Alexa account so I can easily view my doorbell camera and turn on and off my patio lights using the remote's voice control. I like it so much that I bought another one during the Labor Day sale and I'm honestly considering a third one! ||| review2 - I think it’s a great TV. It supports AirPlay and works really well, plus it comes with all the usual streaming features Fire TV offers. We bought it in late November to early December 2025 and I highly recommend it. We even picked up the 55-inch when it was on sale, and it pairs perfectly with our 32-inch Insignia Fire TV. ||| review3 - I have the Insigna TV in my bedroom and I needed a TV in the kitchen area. Since the TV in my bedroom is of good quality, I decided to get another one... excellent TV, it picks up the internet signal very well... the brand is recommended. ||| review4 - We’ve been really happy with my Insignia 32"" F20 Series LED HD Smart Fire TV. The picture quality is clear and bright for a 720p set, and the size is perfect for my husband’s garage set up. The built-in Fire TV interface makes streaming incredibly easy—everything loads quickly, and navigating between apps is smooth. Setup was simple and only took a few minutes. The sound quality is decent for a TV this size. Overall, it’s a solid, reliable TV at a great price point and does exactly what I needed it to do. ||| review5 - Excellent quality! Great price for smart fire tv. Perfect size for my space. Fit the rolling stand I bought to mount on. Definitely worth it and would highly recommend!!! ||| review6 - I bought this smaller TV after a disappointing experience with a larger one. The picture is good, the sound is great and the setup was pretty easy. I have binged all seasons of Stranger Things and Wednesday so I know this is a good TV. I use it every evening and am very satisfied with its performance. ||| review7 - This TV has been perfect for my small apartment. The picture quality is excellent, making watching shows and movies a great experience. It’s also very user-friendly—simple to set up and easy to navigate through the menus. I’ve had no issues with performance, and it runs smoothly every time I use it. Overall, it’s a reliable, high-quality TV at a reasonable price that feels just right for a smaller living space. ||| review8 - Super simple to set up. Wonderful picture and clarity. I have a couple other Insignia tvs and never had a single problem! ||| review9 - I bought this 32 inch smart tv for my senior mom. It shows beautifully & easy for my mom to work. ||| review10 - I really love the 32 Fire TV shows good I also find away to Bluetooth my speakers and sounding like a sound bar ||| review11 - We bought this when our other tv went out. Great Picture. Easy setup. Amazing Price. ||| review12 - this great beautiful colors and motion is great I don't see any lags . bought an open box excellent condition. open it up and box it. still have plastic cover on the screen. paid 22 . 30 for it . i bought it for my cats !! they like it !!! i even watch it . ||| review13 - Buying a TV on a budget has never been better. I was pleased with the arrival delivery was a priority. Installation was easy. Navigating was simple with voice search capabilities like pressing the mic and speaking into the remote. Picture quality is good keeps me glued, sound quality is awesome i am an avid watcher of Marvel Studios productions so its action baby. And its lit in this room. Also allows streaming from all platforms youtube hulu disney apple netflix. ||| review14 - Great Television with very crystal clear pictures and volume both! It’s also light weight and can be mounted on a wall! ||| review15 - Will buy again. But, volume controls have to be increased between 40-60 to hear well. Love Alexa services. Legs to tv is very hard to get on. Picture quality is really good. Love the lightweight of tv for mobility. ||| review16 - Great product and good price for a smart TV!! Would definitely recommend to others, good for small spaces.. ||| review17 - The Smart InsigniaTV we wanted was on sale making it very affordable. It was in stock and we were helped right away by a friendly sales assistant who answered our questions. Check-out was quick. In the short time we've had the TV however, it has had a glitch that froze it and all the controls on the remote. That was solved by unplugging and re-plugging the set. We like the bright picture. Our DVD's don't play well on it though. They are dim and not in sharp focus like when we played them on our older Panasonic set. ||| review18 - Excellent tv perfect for my room recommend everyone to buy this tv perfect size small rooms ||| review19 - Great smart TV for the price. Works great and eady to set up. I highly recommend it. ||| review20 - Fits perfect in the spot i wanted it. Easy to attach to a wall mount. Color is good sound is okay but i have a sound bar that works with it.",,,88% would recommend to a friend,4,1,,,"Insignia™ - 32"" Class F20 Series LED HD (720p) Smart Fire TV ||| Insignia™ - 32"" Class FE Series LED 1080p Full HD Smart Fire TV ||| Toshiba - 32"" Class V35 Series LED HD 720p Smart Fire TV (2025) ||| Samsung - 32"" Class F6000F Series LED Full HD Smart Tizen TV (2025)",95,,w20,2026-05-16 1:40,2025,b_20260516_010504,SEA
296308,J3PFCJQQXJ,Bestbuy,main,118,"Roku - 40"" Class Select Series Full HD (1080p) LED Smart RokuTV (2026)",https://www.bestbuy.com/product/roku-40-class-select-series-full-hd-1080p-led-smart-rokutv-2026/J3PFCJQQXJ,4.8,118,40 inches,$139.99 ,$229.99 ,$90 ,1,"Pick up Fri, May 22","Get it by Sun, May 17   • FREE",,,,"review1 - Awesome television set. Great pictureamd easy set up ||| review2 - I’ve been using my Roku TV for a little while now and honestly, I really like it. It’s super easy to set up and navigate, which made the whole experience stress-free right from the start. The home screen is clean and simple, so I can quickly find all my favorite apps like Netflix, Hulu, and YouTube without having to search around. The picture quality is really nice for everyday watching, and everything streams smoothly without lag.I can customize the home screen to keep my most-used apps front and center. It’s a great option if you mainly want a TV for streaming and easy entertainment. I definitely recommend Roku TV. It’s affordable, user-friendly, and perfect for anyone who wants a simple, reliable smart TV experience. ||| review3 - The Roku 40"" Select Series TV is very easy to setup. The interface is very intuitive to navigate. The picture quality is sharp and vibrant for this price point and it is the perfect size for my family. ||| review4 - This Roku Select Series is a great buy for the price! It features all the updated Roku software/ firmware and has a great picture for a smaller budget television. We opted for the 40” for our relaxing space upstairs and it was a little to big for the space where it has to mount on the wall, so unfortunately we had to return it, bit will most likely go with a 32” of the same series to fit the space in the days to come. We are accustomed to the Roku platform and have always enjoy it. This tv is simple to unbox and set up with all the Roku platform features and is customizable to your preferred settings. We highly recommend the Roku platform and any of Rokus new TVs that are available from Best Buy. Enjoy your purchase! ||| review5 - I am greatly pleased that I decided to make this purchases. I upgraded a 32 in Insignia to this 40 in Roku after yet another Zumo box from Infinity failed, This tv fits nice,y in my bedroom. The oicture quality is better than I expected. Setup was really quick and easy, The channel selections are more than adequate, At this price point I would have expected less. While the sound quality is acceptable, I would suggest adding a sound bar to enhance your audio experince. All in all, I am wondering whhy it took so long for me to make this decision. Buy this and sit back,enjoy, ||| review6 - Beautiful design! Light weight, no assemply was required except east to screw in legs for bottom of TV. The TV image is great and priced well! ||| review7 - Great little TV -- got the 40"". Initially the color was a little wonky but it cleared-up as expected after a day or two. Super fast start-up and internet. Really responsive. Fabulous value for $130. Only one word of warning: The TV has narrow viewing angles — color and contrast drop noticeably when viewed off‑axis -- the colors fade quickly if you’re even a little off to the side. Otherwise, highly recommended ||| review8 - I recently bought a 40-inch Roku TV and overall I’m really happy with it. Setup was quick and easy, and the built-in Roku TV interface is very user-friendly. I like how all the streaming apps are in one place, and navigation feels smooth. ||| review9 - This one’s been a good pickup so far. I mostly use it for Netflix and YouTube and it works just fine, no major issues. The interface is simple which I like, not confusing or anything. Sound is okay, not amazing but decent enough unless you really care about that stuff. Had a small lag once or twice but nothing crazy. Overall pretty happy with it. ||| review10 - Great tv! Easy to assemble, great picture quality! Cons - 1. The remote records! I don't like the idea of having to watch what I say around my remote. But that's more of a con to technology. 2. The remote is very sensitive! It was under the pillow. I laid on the power button by mistake and it turned the tv off. ||| review11 - This is the third Roku product I have purchased from Best Buy and it has never let me down. I recently replaced my Roku with an insignia thinking I'd give a different version a try. I love the insignia with the exception that I could not watch Spectrum. But, as it turns out, my father's TV went out and I gave him my Insignia and I purchased this wonderful Roku which I absolutely love! Plug and Play and it's ready to go! ||| review12 - Quality picture and perfect size for my mom's room. The price was very reasonable! ||| review13 - I enjoy our tv. It’s perfect n just the right size. Thank you for all the help we got there at Best Buy. ||| review14 - Plug it in and you’re ready to go. Very easy to set up apps. Great picture and sound. I was surprised how light it is - not a heavy TV. User friendly remote. Now the negative - not impressed by just having 2 feet to support instead of a stand. ||| review15 - Easy to set up, color is great, usability excellent!!! Would highly recommend!! ||| review16 - Quick delivery and easy setup. Helped me quickly check off something from my move in to do list. Tv hasn't had any issues ||| review17 - Easy set up good sound good picture. I like roku a lot of free stuff to watch. I think the picture is as good as any tv ||| review18 - Easy set up and great picture. Linked right away to my Roku account. ||| review19 - The tv works good. It’s fast changing from different apps. ||| review20 - Its a great tv for the money.Easy to set up.Color is great.",,,99% would recommend to a friend,5,11,,,"Roku - 40"" Class Select Series Full HD (1080p) LED Smart RokuTV (2026) ||| Pioneer - 40"" Class LED Full HD (1080p) Smart Roku TV ||| Samsung - 40"" Class F6000F Series LED Full HD Smart Tizen TV (2025) ||| Roku - 43"" Class Select Series 4K LED Smart RokuTV",86,,w20,2026-05-16 1:41,2026,b_20260516_010504,SEA
