id,item,account_name,page_type,count_of_reviews,retailer_sku_name,product_url,star_rating,count_of_star_ratings,screen_size,final_sku_price,original_sku_price,savings,offer,pick_up_availability,fastest_delivery,delivery_availability,shipping_info,sku_status,detailed_review_content,summarized_review_content,top_mentions,recommendation_intent,main_rank,bsr_rank,promotion_position,trend_rank,retailer_sku_name_similar,estimated_annual_electricity_use,promotion_type,calendar_week,crawl_datetime,model_year,batch_id,country
296304,JJ8VPZTKZW,Bestbuy,main,430,"LG - 77"" Class B5 Series OLED AI 4K UHD Smart webOS TV (2025)",https://www.bestbuy.com/product/lg-77-class-b5-series-oled-ai-4k-uhd-smart-webos-tv-2025/JJ8VPZTKZW/sku/6621813,4.7,430,77 inches,"$1,499.99 ","$2,999.99 ","$1,500 ",4,Pick up tomorrow,,"Delivery as soon as Wed, May 20",,Sponsored,"review1 - This TV is absolutely gorgeous. Coming from a plasma with great inky blacks I did not want to upgrade at all but I am glad to have gone OLED. And don't let the ""entry level"" tag placed on this tv fool you, it's OLED through and through. Beautiful colors and deep pure blacks. And with the right settings, the picture is natural and sharp. I am beyond happy. The speakers are way better than I would have ever thought. My only negative is that OS is sluggish. I like it better than some others but it's a little slow which is where the price probably comes in. But it's not bad enough for me to pay the difference for the next model up. Overall I highly recommend this TV for exceptional movie watching and gaming. ||| review2 - This LG OLED B5 AI 77” is absolutely worth it. The picture quality is stunning — deep blacks, vibrant colors, and excellent brightness for both movies and sports. Dolby Vision and HDR really make a huge difference. The motion handling is smooth, perfect for fast-paced action or gaming. The AI processor does a great job optimizing the image and upscaling lower-resolution content. Sound is surprisingly good for a slim TV, but pairing it with a soundbar takes the experience to another level. The design is sleek and modern, and it looks beautiful mounted on the wall. WebOS is very fast and user-friendly, with all the apps I use (Netflix, Prime, Apple TV+, YouTube) running smoothly. Overall, an excellent purchase — premium quality at a great price. Highly recommend it if you’re looking for a large screen OLED with amazing performance. ||| review3 - I am absolutely blown away by the infinite contrast and vibrant colors on this LG OLED. Coming from a standard LED TV, the difference is night and day; the ""perfect blacks"" make movies feel like a true cinema experience. Even in a brightly lit room, the picture remains crisp and clear. If you’re a movie buff looking for the best visual experience possible, this is worth every penny. ||| review4 - We bought this to upgrade from a seven year old LG 65” 4K LED tv. The difference is amazing. This 77 inch 4K OLED LG has a noticeably better picture, blacks are blacker, and colors are more vivid. The new style magic remote is definitely an upgrade. The TV was delivered and installed by Best Buy. They did a wonderful job on the installation as well as explaining the features. They installed an in wall wire kit and did a professional job. I bought this during the Black Friday sales and saved almost 50% off the list price. I’ve used Best Buy for years and plan to continue using them in the future. ||| review5 - Great picture, easy setup, and worth the deal. I compared this TV to others but this one took the cake when it came to picture quality, user ability and size. ||| review6 - I’m extremely impressed with the 77"" B5. The picture quality is absolutely stunning, and the OLED really shines with vibrant colors, deep blacks, and excellent brightness. When I’m watching movies or sports, the images are incredibly immersive and crisp. This TV consistently delivers an impressive viewing experience. Overall, I couldn’t be happier with the image quality, and it easily exceeds my expectations. ||| review7 - Best TV I’ve ever seen. The darks are so dark and the lights are so light. It almost feels like I’m IN the show/movie I’m watching because of how good it is. The sound????? CRAZY!! I usually can’t have it over 20 because the sound quality is just so amazing. Game night was taken to the next level with this TV. It’s big enough that I almost feel like I’m at a movie theater but not too big to where I feel like my whole room is a TV. ||| review8 - I'm amazed with the 77"" LG tv. The picture quality is absolutely stunning, and really shines with vibrant colors and excellent brightness. Whatever I'm watching the images are sharp. I am very happy with the image quality, and very impressed. ||| review9 - LG Oled products are the best value and quality in the current market. Been owning several of there Oled TVs like the Oled EVO C model for more than 3 years and its never given me issues. One thing I dont like is that the remote the tv came with is nothing like the remote from my other tv I previously mentioned. It feels hollow, fragile, and cheaply made in comparison to other remotes LG has released with other oled TVs. (First image is the remote the Tv came with, second image is from the other Oled Tv) ||| review10 - This LG OLED B5 is absolutely stunning! The picture quality is crystal clear, with deep blacks and vibrant colors that make movies and games look incredible. The AI 4K upscaling works perfectly, and the webOS interface is super fast and easy to use. The sound is surprisingly good even without a soundbar. It’s ultra thin, elegant, and looks great on the wall. Totally worth the price — I’d buy it again without hesitation! ||| review11 - love this tv way better than my old curved lg oled ,, blacks are nice and colors just pop very smooth and graphics when playing video games ,, magic remote is better than the old model and sound is amazing ||| review12 - This was my first OLED TV ever and let me tell you it does not disappoint! I was looking at the specs between the C5 and the B5 and for the money it just seemed more worth it to get the B5 and I can tell you it looks amazing! Actually thinking about buying another one for upstairs. ||| review13 - Amazing TV. Picture quality outstanding. The sound is also good but using a soundbar with it is the superior choice. If you can’t afford to upgrade your tv to a full “OLED EVO” TV without sacrificing the size you want and that is out of your budget, then this TV will be perfect for you. We had just an LG LED TV and upgrading to an LG OLED made a huge difference which you definitely notice. So I guess what I’m saying is if you want a better quality tv compared to your current one and you don’t care about size, then go for an OLED EVO TV. If you don’t want to sacrifice size but still have the best quality upgraded tv then this one would be perfect for you. ||| review14 - Excellent picture, color and contrast. Black Friday deal at half price was great value. TV is very light and thin. Tested sound from TV without the sound bar and it was surprisingly louder and clearer than expected. ||| review15 - Tv has great picture and super thin and sleek. I plan on Mounting it which should make it look even better! ||| review16 - First OLED tv that I've purchased and im happy that this was the one i chose. Got it on the black Friday sale and I couldnt pass up the discount. Colors are fantastic, no issues with brightness. Only thing is the AI sound focuses too much on voice when watching anime or other animated shows so when watching those I switch the sound to standard. ||| review17 - Excellent picture with amazing color and brightness.Amost a non glare screen,very thin with a 1/4 inch bevel. Highly recommend ||| review18 - Love it my heart was set on a C5 television for my basement but I got this on sale. So I decided to go for it no regrets at all the picture quality is fantastic and brightness level is perfect for my area I believe the C5 is a lot brighter if you are placing it in a when lit room. No complaints here. ||| review19 - really nice tv, the quality is amazing. has really comfortable remote control with ai. The size of tv is perfect ||| review20 - I do miss the brightness of the C series a little, but the B series is perfectly fine for me, and I love the colors. The B5 is one of the TVs that offers excellent value for money; I recommend it if you're not too demanding and prefer a fairly natural brightness.",,,95% would recommend to a friend,1,4,,,"LG - 77"" Class B5 Series OLED AI 4K UHD Smart webOS TV (2025) ||| LG - 77"" Class C5 Series OLED evo AI 4K UHD Smart webOS TV (2025) ||| Samsung - 77” Class S85F Series OLED 4K UHD SamsungVision AI Smart Tizen TV (2025) ||| Samsung - 75” Class Q7F Series QLED 4K UHD SamsungVision AI Smart Tizen TV (2025)",344,,w20,2026-05-16 1:36,2025,b_20260516_010504,SEA
296305,J3ZYG2V5FW,Bestbuy,main,"1,810","Samsung - 55"" Class U7900 Series UHD 4K Smart Tizen TV (2025)",https://www.bestbuy.com/product/samsung-55-class-u7900-series-uhd-4k-smart-tizen-tv-2025/J3ZYG2V5FW,4.7,"1,810",55 inches,$249.99 ,$379.99 ,$130 ,1,"Pick up Wed, May 20",,"Delivery as soon as Wed, May 20",,,"review1 - I’m extremely happy with my 55-inch Samsung TV. The picture quality is outstanding—colors are vibrant, the contrast is sharp, and everything looks incredibly clear whether I’m watching movies, sports, or streaming shows. The 4K resolution really makes a difference, especially with newer content. The sound quality is also surprisingly good for a flat-screen TV, but it pairs perfectly with a soundbar if you want an even more immersive experience. Setup was quick and easy, and the smart features are very user-friendly. I love how fast the apps load and how seamless it is to switch between streaming services. The design is sleek and modern, with a thin bezel that looks great in my living room. Overall, it feels like a high-quality product that delivers excellent performance for the price. I would definitely recommend this TV to anyone looking for a reliable and great-looking upgrade. ||| review2 - I picked this up to replace a 50-inch Samsung that’s about nine years old, and it’s clear the brand hasn’t lost its touch. The picture quality is excellent, with rich colors and a noticeably improved interface compared to older models. The panel isn’t the brightest on the market, but it still performs well in daylight, even with some glare. The redesigned remote is simpler and more intuitive, which pairs well with the TV overall. My only real complaint is that the interface can feel sluggish. It’s not a deal-breaker, but it’s something I don’t typically notice on other TVs in this price range. Overall, it’s a strong upgrade with a few quirks, but nothing that overshadows the solid performance. It would easily earn five stars if the interface weren’t packed with ads and sponsored content. Pairing it with a streaming device or a console and setting the TV to power on to the last used input bypasses most of the UI issues, leaving you with a well-priced panel that performs reliably. ||| review3 - I am extremely impressed with the Samsung 55"" U7900 Series! The picture quality is outstanding—crisp 4K detail, vibrant colors, and excellent brightness make movies and sports look incredible. The upscaling is surprisingly good too, so even older content looks sharp. The Tizen interface is fast, intuitive, and packed with apps. Switching between streaming services is seamless, and the remote is simple and responsive. Sound quality is better than I expected for a slim TV, and pairing it with my soundbar via HDMI-ARC was effortless. The design is modern and sleek, and it fits perfectly in my living room. Setup was quick, and the TV automatically recognized my connected devices. Overall, this is an amazing value for a 2025 model—great performance, great features, and great picture quality. Highly recommended! ||| review4 - This was an impulse purchase, that I really didn't need, but I am so happy with it. The size is perfect for me and my space. The picture is amazing. The sound is amazing. It links to my Samsung phone, which I'm still trying to play with, but overall, it was a great purchase. ||| review5 - I was a bit disappointed the first few days we had this tv but I found some bass line settings and mad the adjustments and it’s looking pretty good now. We have a Samsung Q80 in the living room and by comparison there’s no comparison but for the money I’m very happy with this as a bedroom tv. It obviously doesn’t get as bright as the set but it’s bright enough for me.Like a lot of other reviews the remote leaves a lot to be desired especially with older hands it’s very small. ||| review6 - I recently got the Samsung 55"" Class U7900 Series UHD 4K Smart Tizen TV (2025), and I absolutely love it! It has completely transformed my viewing experience, and I couldn't be happier. I recently got this TV, and it fits perfectly in my apartment without overpowering the space. Setup was a breeze, and the picture quality is absolutely stunning—crisp, clear, and bursting with vibrant, natural colors. It really elevates my entire viewing experience with its rich sound quality that’s just as impressive. Navigating through its innovative features is surprisingly easy, making watching TV more fun than ever. I love how quickly I can switch between channels and apps, save shows to my library, or return to live TV—everything happens almost instantly. Rewinding live TV to catch a missed line in a show and then seamlessly catching up to the livestream? Absolutely fantastic. I’ve only scratched the surface of what this TV can do, but I already appreciate how streamlined the remote is—super thin and easy to handle. Plus, if I prefer, I can download an app on my phone to control it. Overall, I’d say this TV is simply incredible! ||| review7 - This television has beautiful theater quality picture and sound. The set up was simple and intuitive. However, I hate the remote as much as I love the tv. It’s small and functions are crammed in. I had to use the manual to figure out the volume control. ||| review8 - The picture definition is incredible, super easy to set up and use. Looks great in a smaller space, even at 55"". Sound is excellent. If you have a Samsung phone, using Smart Things to control the TV from anywhere is a nice feature. ||| review9 - I am still getting the hang of my new Samsung 55"" TV. Its Smart Tizen operating system is different from that of my other Samsung TV. My enjoyment of that TV gave rise to the current purchase, where undeniably there is a learning arc yet to be traveled. That said, this TV seems to actively thwart channel surfing. The interface is cluttered and difficult to navigate. It forever leaves me without a full picture of what is available to be watched, particularly disappointing where Samsung TV Plus is concerned. Program loading runs the gamut from pokey to minutes-long. I am adapting by learning what is on prior to power up and, once at a channel, am inclined to stay, even to the point of suffering through commercials. (Thank God there is still a mute feature.) AT&T delivers to me ultra fast fiber optic internet speed, so I discount connection issues as an important cause of any slowness. That said, I think my Samsung 55"" Class U7900 Series UHD 4K TV is worth the $302 I paid Best Buy to have it appear at my doorstep. The picture is large and decent, and I do enjoy watching it. ||| review10 - It was very easy to take it out of the box and install it in my living room, it's a light television and it didn't cost me much to connect it to the internet, I just followed the instructions ... I love its resolution and the remote control is very easy to use ... I'm not very skilled at using things with technology but this time I was able to do everything myself following the instructions and I didn't need help ... I love it !!! ||| review11 - Love the crisp picture and the beautiful colors. We didn’t want to wall mount the TV and this has the easiest legs to put on. Extremely happy with this purchase! ||| review12 - This tv was delivered on time with a very helpful staff. I was notified prior to delivery with a phone call letting me know they were on the way and when they would make delivery. Not even a scratch on the box and brought up the stairs to the second floor. The staff was professional and courteous. The best part is I have a Beautiful tv for an amazing price! I could not be happier with Best Buy! The picture is amazing, the connection to bluetooth and smart things is effortless. A fabulous tv! Highly recommended!! The controller is simple and easy to use, so few buttons to navigate. Thank you! ||| review13 - Amazing picture and sound for the price. Light weight and easy to set up ||| review14 - Nice clear picture. Great size. Light weight and was easy to install. ||| review15 - When I purchased this Samsung to replace my old LG I didn’t expect it to have such an excellent picture. The depth of color and fluidity of the picture is top notch. I hung it in my bedroom and I don’t have a sound bar but the volume is really good. For less than 250 dollars this was a great purchase! Also the Smart TV channels offer a large variety of programming and could easily replace a set-top cable box. ||| review16 - My Samsung TV is wonderful and easy to navigate the channels and apps ||| review17 - Positive FlatScreen Television, have had no issues within the first few months. Has so many wonderful features. And a wonderful bargain for its size. ||| review18 - Amazing, easy to put together ( basically plug and play ) clear picture ||| review19 - Super easy setup right out of the box. Picture is wonderful and integrating with the sound bar and subwoofer took just a few minutes. ||| review20 - This 55” Samsung Crystal UHD 4K TV is good for the price. I needed a good budget TV for my living room and Samsung delivered with their Crystal UHD 4K TV although I had to get used to their Tizen software and the new remote control which I caught on with. I would recommend this Samsung TV 2025 model to anyone that is looking for a great budget TV that doesn’t want to spend more than $500. Thanks Best Buy!",,,94% would recommend to a friend,2,6,,1,"Samsung - 55"" Class U7900 Series UHD 4K Smart Tizen TV (2025) ||| Samsung - 55” Class U8000F Series Crystal UHD 4K Smart Tizen TV (2025) ||| Insignia™ - 55"" Class F50 Series LED 4K UHD Smart Fire TV ||| Samsung - 55” Class Q7F Series QLED 4K UHD SamsungVision AI Smart Tizen TV (2025)",187,,w20,2026-05-16 1:37,2025,b_20260516_010504,SEA
